{
  "_schema_version": "2.0",
  "phase": "READY",
  "reason": "a2dp_route_confirmed",
  "preferred_device": {
    "mac": "AA:BB:CC:DD:EE:FF",
    "name": "JBL Flip 5",
    "paired": true,
    "trusted": true
  },
  "active_output_device": "AA:BB:CC:DD:EE:FF",
  "connection_status": {
    "connected": true,
    "services_resolved": true,
    "profile": "a2dp_sink",
    "sink": "bluez_sink.AA_BB_CC_DD_EE_FF.a2dp_sink"
  },
  "a2dp_ready": true,
  "retry_after_seconds": 0,
  "updated_at": "2026-07-09T12:00:00Z"
}
